{
  "schemaVersion": 1,
  "revision": "2026-10-22",
  "description": "ACP Remote feature ID 机器登记 v1：Sync 与 Node Link 的封闭 feature 词表。协议文档 §5.2 / §11.3 的 feature 表、fixture 里出现的 feature ID 与本文件由 scripts/check-features.mjs 断言逐一相等；新增或删除 feature 必须先改本文件。required 表示协议要求每次协商都必须选中该 feature（产品必须支持由 delivery 表达）。",
  "protocols": {
    "sync": {
      "source": "docs/SYNC_PROTOCOL.md §5.2",
      "features": [
        {
          "id": "core.snapshot.v1",
          "description": "快照订阅与 sync.snapshot_* 消息族",
          "delivery": "mvp",
          "required": false
        },
        {
          "id": "core.command-status.v1",
          "description": "命令终态查询与 command.result 的终态字段",
          "delivery": "mvp",
          "required": false
        },
        {
          "id": "core.event-ack.v1",
          "description": "客户端 ACK 与断线续传（sync.ack）",
          "delivery": "mvp",
          "required": false
        },
        {
          "id": "acp.raw-payload.v1",
          "description": "事件携带 ACP 原文（rawAcp.rawJson 保真，见 §10.3）",
          "delivery": "mvp",
          "required": false
        },
        {
          "id": "resource.remote-origin.v1",
          "description": "imported 资源来源承载（§9.6：ownerNodeId/origin cursor/online）",
          "delivery": "mvp",
          "required": false
        },
        {
          "id": "resource.stateless-origin.v1",
          "description": "无持久中转的远程来源流/运行期 ACK（§9.7）：`sync.remote_subscribe`/`remote_event`/`remote_caught_up`/`remote_ack`/`remote_reset_required`/`remote_unsubscribe`/`remote_unavailable`/`remote_catalog_changed`/`remote_source_state` 帧族、Owner origin cursor 直接作为订阅游标、`session.read` 的 `readCursor`/`sessionSummary`/`messageCoverage` 与 `command.status` 的 `remoteTarget`；Access 不持久化远程正文、收据、ACK 或命令状态",
          "delivery": "mvp",
          "required": false
        },
        {
          "id": "core.local-catalog.v1",
          "description": "本机 workspace 目录与 Agent profile 随快照下发（§9.4 `workspaces`/`agents` 资源与 §10.3 的 workspaceRef/agentCatalogEntry），`session.create` 的选择器由它供数",
          "delivery": "mvp",
          "required": false
        },
        {
          "id": "core.session-create.v1",
          "description": "Sync 面 `session.create`（§11.5 的目录来源二选一 payload——`directoryId` 或客户端提供的 `workspacePath`——加必填 `agentId`，以及可选的「目录不存在则先创建」开关；completed 终态结果）",
          "delivery": "mvp",
          "required": false
        },
        {
          "id": "core.session-history.v1",
          "description": "Sync 面按会话读取结构化历史条目（§11.5 的 `session.read` 新 include 取值 `history`、`beforeHistory` 序号游标、结果里的 `history`/`historyHasEarlier` 与 §9.4/§10.2 的条目类型集合）",
          "delivery": "mvp",
          "required": false
        },
        {
          "id": "core.event-origin.v1",
          "description": "事件帧 `origin` 的身份字段（`nodeId`）与 `node` 取值",
          "delivery": "mvp",
          "required": false
        },
        {
          "id": "core.workspace-browse.v1",
          "description": "Sync 面逐层浏览节点目录的查询命令 `workspace.browse`（§11.5 的请求/结果形状、失败分类与单层条目上限）",
          "delivery": "mvp",
          "required": false
        },
        {
          "id": "core.workspace-mkdir.v1",
          "description": "Sync 独立创建当前父目录下的一层目录 workspace.mkdir",
          "delivery": "mvp",
          "required": false
        },
        {
          "id": "core.file-diff.v1",
          "description": "`file.changed` 事件视图携带结构化差异行（§10.3 的 `diffLines` 与 `diffUnavailable`；只在协商时出现该键）",
          "delivery": "mvp",
          "required": false
        },
        {
          "id": "core.session-files.v1",
          "description": "Sync 面当前会话工作目录内的只读文件查询：`session.files.list`/`session.files.read` 与 `session.git.status`/`session.git.diff`（§11.5 的请求/结果形状、§14 的分页与内容预算）；只登记 Sync，不进入 Node Link",
          "delivery": "mvp",
          "required": false
        },
        {
          "id": "core.session-git-stats.v1",
          "description": "Optional addedLines/deletedLines on session.git.status entries; requires core.session-files.v1.",
          "delivery": "mvp",
          "required": false
        },
        {
          "id": "core.session-git-compare.v1",
          "description": "Complete bounded HEAD/worktree text in session.git.diff comparison; requires core.session-files.v1.",
          "delivery": "mvp",
          "required": false
        },
        {
          "id": "core.attachment-transfer.v1",
          "description": "独立已认证附件 WSS 连接（§3.4）：`attachment.begin`/`chunk`/`chunk_ack`/`seal`/`sealed`/`status`/`abort`/`read`/`read_chunk`/`manifest_begin`/`manifest_page`/`manifest_sealed`/`error` 帧族；32 KiB 单块、十进制字符串偏移、每传输一块未确认、单设备 2/单节点 8 个活动传输；未协商时新帧族与 `attachment_ref` 必须缺席",
          "delivery": "mvp",
          "required": false
        },
        {
          "id": "core.typed-media.v1",
          "description": "类型化媒体与消息通道（§10.4）：`AgentContentBlock` 的 `audio_ref`/`file_ref` 与 `image_ref.attachmentId`、`messageChannel`、`partialResult` 与媒体引用可用性；完整 ACP 原文仍逐字节保留",
          "delivery": "mvp",
          "required": false
        },
        {
          "id": "core.pending-interactions.v1",
          "description": "可恢复的有效待处理交互（§10.4/§11.7）：`session.read` 的 `pending_interactions` 返回完整当前请求与 `requestVersion`，应答前重新校验有效性，首个有效答案胜出；已处理/失效请求不可复活",
          "delivery": "mvp",
          "required": false
        },
        {
          "id": "core.remote-history.v1",
          "description": "远程历史读取（§9.6/§11.5）：imported 会话的结构化历史按会话内序号独立分页、读取前重新鉴权、正文由 Owner 回源提供；不可达或超出保留期显式不可用，Access 不持久化正文",
          "delivery": "mvp",
          "required": false
        },
        {
          "id": "core.session-activity.v1",
          "description": "会话主状态三态合同（§10.2）：`sessionSummary.state` 只有 `idle`/`running`/`pending` 三个取值——存在有效未解决交互时为 `pending`，否则存在未结束任务（含已接受的排队任务）时为 `running`，否则为 `idle`；create/read/list/快照/事件视图与 Node Link 的 `sessionMeta`、catalog 会话共用同一取值集合。排队、等待原因与任务/命令结果不属于本 feature；旧七态只允许作为历史事件 `view` 的原文出现。required=true：双方必须选中，缺失时服务端返回 `protocol.feature_required`、客户端停止同步，选中前不得收发任何三态摘要、快照或事件载荷",
          "delivery": "mvp",
          "required": true
        },
        {
          "id": "core.session-title.v1",
          "description": "Owner 元数据命令 `session.title.set`（§11.5 的 closed payload `{ title: string }`）与有效标题投影：标题由 Owner 持久化（自定义标题优先，否则 Agent 标题），`SessionSummary.title` 始终下发有效值、不新增 `customTitle` 键；Access 不回源持久化标题，未协商时命令返回 `protocol.feature_required`",
          "delivery": "mvp",
          "required": false
        },
        {
          "id": "core.local-session-lifecycle.v1",
          "description": "本机会话生命周期投影与激活（§9.8/§10.2/§11.5/§11.8）：门控 Sync 面 `session.resume`、查看控制帧 `session.view`/`session.view.result`、owned 摘要的可选 `localActivity`（`idle`/`active`/`pending`）与持久事件 `session.activity.changed`；未协商时该命令回 `command.unsupported`、该字段与事件缺席、查看控制帧被拒。只在 owned 路径交付，Node Link 不登记该 feature、不转发新字段或新事件",
          "delivery": "mvp",
          "required": false
        }
      ]
    },
    "node_link": {
      "source": "docs/NODE_LINK_PROTOCOL.md §11.3",
      "features": [
        {
          "id": "node-link.core.v1",
          "description": "握手、catalog、resource snapshot/event/ACK、错误与 limits",
          "delivery": "mvp",
          "required": true
        },
        {
          "id": "node-link.raw-acp.v1",
          "description": "resource.event.payload.acp 携带 ACP raw document 并保真",
          "delivery": "mvp",
          "required": false
        },
        {
          "id": "node-link.command-status.v1",
          "description": "command.status 查询与 command.terminal 重查",
          "delivery": "mvp",
          "required": false
        },
        {
          "id": "node-link.session-create.v1",
          "description": "command.submit{command:\"session.create\"}（Zed session/new 的映射）",
          "delivery": "mvp",
          "required": false
        },
        {
          "id": "node-link.node-rotation.v1",
          "description": "node.rotate-key.*（只登记 ID 与消息名，收到即返回 type_unsupported）",
          "delivery": "post_mvp",
          "required": false
        },
        {
          "id": "node-link.attachment-transfer.v1",
          "description": "节点间独立已认证附件连接（§12.9）：与 Sync 同名的 13 个附件帧、32 KiB 单块、十进制字符串偏移与流式摘要；主体绑定为已认证节点，Access 只做有界内存转发、不落盘",
          "delivery": "mvp",
          "required": false
        },
        {
          "id": "node-link.typed-media.v1",
          "description": "跨节点类型化媒体、消息通道与部分结果（§11.4）：`resource.event.payload.view` 的媒体引用/思考/部分结果与 Sync §10.4 同义；Access 不解析 ACP 原文，完整原文仍逐字节保真",
          "delivery": "mvp",
          "required": false
        },
        {
          "id": "node-link.pending-interactions.v1",
          "description": "跨节点有效待处理交互与真实表单（§12.7）：读取当前有效完整请求、`requestVersion` 校验与首个有效应答胜出；历史待处理项不可直接应答",
          "delivery": "mvp",
          "required": false
        },
        {
          "id": "node-link.remote-history.v1",
          "description": "远程历史回源（§12.7/§17）：Access 按 origin cursor 向 Owner 读取历史分页、读取前鉴权；Owner 不可达或超出保留期显式不可用，Access 不持久化正文",
          "delivery": "mvp",
          "required": false
        },
        {
          "id": "resource.stateless-origin.v1",
          "description": "无持久中转的远程来源流/运行期 ACK（§11.4/§12.4）：`resource.caught_up` 来源重放屏障、`resource.reset_required`/`resource.unavailable` 显式错误、`resource.ack` 收窄为当前连接/来源会话的运行期累计处理进度（不表示 Access 落盘），以及 `session.read` 的 `readCursor`/`sessionSummary`/`messageCoverage` 与 `command.status` 的 `remoteTarget`",
          "delivery": "mvp",
          "required": false
        },
        {
          "id": "core.session-activity.v1",
          "description": "跨节点会话主状态三态合同（§11.4/§12.3/§12.4）：`sessionMeta.state` 与 catalog `sessions[].state` 只有 `idle`/`running`/`pending`，与 Sync `sessionSummary.state` 同一取值集合——有效未解决交互优先为 `pending`，其次未结束任务（含排队）为 `running`，否则 `idle`；排队、等待原因与任务结果不经本 feature。旧七态只允许作为 `resource.event.payload.view` 的历史原文出现。required=true：双方必须选中，缺失时 Owner 返回 `nodelink.protocol.feature_required`、Access 停止业务同步，选中前不得收发任何三态元数据或事件",
          "delivery": "mvp",
          "required": true
        },
        {
          "id": "core.session-title.v1",